{
  "schema_version": "effective-profile-context-1.0",
  "applicant": {
    "schema_version": "applicant-profile-1.0",
    "profile_id": "fictional-profile-river",
    "citizenships": ["IND"],
    "country_of_residence": "IND",
    "age_years": 31,
    "date_of_birth": null,
    "occupation": {"user_text": "Software engineer", "taxonomy_id": "isco08", "taxonomy_version": "2008", "code": "2512", "mapping_state": "MAPPED"},
    "specialization": "Distributed systems",
    "experience_years": 7.5,
    "qualifications": [{"level": "MASTERS", "field": {"user_text": "Computer science", "taxonomy_id": "isced-f-2013", "taxonomy_version": "2013", "code": "0613", "mapping_state": "MAPPED"}, "awarding_country": "IND", "institution": "Fictional Northbridge Institute", "completion_year": 2018, "recognition_state": "NOT_ASSESSED"}],
    "professional_registrations": [],
    "languages": [{"language": "English", "evidence_type": "NAMED_TEST", "test_name": "Synthetic English Test", "level_or_score": "C1", "valid_until": "2027-12-31"}],
    "unknown_fields": [],
    "field_provenance": {"applicant.citizenships": {"source": "USER_SUPPLIED", "captured_at": "2026-08-05T10:00:00Z"}, "applicant.occupation": {"source": "USER_SUPPLIED", "captured_at": "2026-08-05T10:00:00Z"}, "applicant.age_years": {"source": "USER_SUPPLIED", "captured_at": "2026-08-05T10:00:00Z"}}
  },
  "household": {
    "schema_version": "household-profile-1.0",
    "household_id": "fictional-household-river",
    "partner_status": "SPOUSE",
    "partner_accompanying": true,
    "partner_work_intent": "WORK",
    "dependants": [{"role": "DEPENDENT_CHILD", "relocating": true, "age_band": "UNDER_18", "age_years": null}],
    "unknown_fields": ["household.child_ages"],
    "field_provenance": {"household.partner_status": {"source": "USER_SUPPLIED", "captured_at": "2026-08-05T10:00:00Z"}, "household.dependants": {"source": "USER_SUPPLIED", "captured_at": "2026-08-05T10:00:00Z"}}
  },
  "scenario": {
    "schema_version": "exploration-scenario-1.0",
    "scenario_id": "fictional-scenario-river",
    "purpose": "EXPLORATION",
    "target_date": "2026-10-01",
    "target_country_codes": ["DEU", "GBR"],
    "target_region_ids": ["region:DE-BE"],
    "job_offer": {"state": "PRESENT", "role": "Software engineer", "employer_region_id": "region:DE-BE", "sponsorship_state": "CONFIRMED", "salary": {"amount": 72000, "currency": "EUR", "period": "ANNUAL"}},
    "intended_occupation": {"user_text": "Software engineer", "taxonomy_id": "isco08", "taxonomy_version": "2008", "code": "2512", "mapping_state": "MAPPED"},
    "intended_study": {"institution": {"user_text": "Fictional Westhaven University", "taxonomy_id": "synthetic-institutions", "taxonomy_version": "1", "code": "FWU-001", "mapping_state": "MAPPED"}, "qualification_level": "MASTERS", "field": {"user_text": "Computer science", "taxonomy_id": "isced-f-2013", "taxonomy_version": "2013", "code": "0613", "mapping_state": "MAPPED"}, "duration_months": 24, "mode": "IN_PERSON", "completion_date": "2027-06-30", "completion_state": "PLANNED"},
    "primary_route_id": "DEU.EU_BLUE_CARD",
    "relocation_composition": "WITH_PARTNER_AND_DEPENDANTS",
    "selected_tfc_ids": ["skilled_work_route_feasibility", "family_accompaniment_reunification", "post_study_work_pathway"],
    "feasibility_filter_mode": "ASSESSMENT_ONLY",
    "unknown_fields": [],
    "field_provenance": {"scenario.target_date": {"source": "USER_SUPPLIED", "captured_at": "2026-08-05T10:00:00Z"}, "scenario.job_offer": {"source": "USER_SUPPLIED", "captured_at": "2026-08-05T10:00:00Z"}, "scenario.primary_route_id": {"source": "USER_SUPPLIED", "captured_at": "2026-08-05T10:00:00Z"}}
  },
  "selected_tfc_ids": ["skilled_work_route_feasibility", "family_accompaniment_reunification", "post_study_work_pathway"],
  "resolved_taxonomy_versions": {"occupation": "isco08-2008", "field_of_study": "isced-f-2013", "institution": "synthetic-institutions-1"},
  "snapshot_hash": "sha256:056b835bd0b9c75a291fbfae20616e22400bf1080444d080449ab4599e748a61",
  "evaluation_timestamp": "2026-08-05T10:01:00Z",
  "retention": {"mode": "TAB_MEMORY_ONLY", "consent": "NOT_REQUESTED", "policy_version": "profile-retention-policy-1.0", "consented_at": null, "expires_at": null}
}
